[
  {
    "protocol_version": "0.1-draft",
    "type": "event",
    "id": "event:979b133d92a8c1528d96a08223b09f00",
    "world": "civ:mock-workshop",
    "sequence": 1,
    "timestamp": "2026-09-30T23:49:14Z",
    "kind": "message.recorded",
    "actor": "agent:operator",
    "body": {
      "message": {
        "body": {
          "stock": {
            "item": "nuts",
            "quantity": 12
          },
          "text": "Operator-supplied fictional stock fact."
        },
        "from": "agent:operator",
        "id": "message:stock-1",
        "protocol_version": "0.1-draft",
        "to": [
          "agent:mock-c"
        ],
        "type": "message",
        "world": "civ:mock-workshop"
      }
    }
  },
  {
    "protocol_version": "0.1-draft",
    "type": "event",
    "id": "event:35c5792e612d6cd1d77fc43827af67e2",
    "world": "civ:mock-workshop",
    "sequence": 2,
    "timestamp": "2026-09-30T23:49:14Z",
    "kind": "message.recorded",
    "actor": "agent:operator",
    "body": {
      "message": {
        "body": {
          "stock": {
            "item": "bolts",
            "quantity": 8
          },
          "text": "Operator-supplied fictional stock fact."
        },
        "from": "agent:operator",
        "id": "message:stock-2",
        "protocol_version": "0.1-draft",
        "to": [
          "agent:mock-c"
        ],
        "type": "message",
        "world": "civ:mock-workshop"
      }
    }
  },
  {
    "protocol_version": "0.1-draft",
    "type": "event",
    "id": "event:ab0ec26c975296c415e5b6ca8e70c854",
    "world": "civ:mock-workshop",
    "sequence": 3,
    "timestamp": "2026-09-30T23:49:14Z",
    "kind": "message.recorded",
    "actor": "agent:operator",
    "body": {
      "message": {
        "body": {
          "stock": {
            "item": "washers",
            "quantity": 20
          },
          "text": "Operator-supplied fictional stock fact."
        },
        "from": "agent:operator",
        "id": "message:stock-3",
        "protocol_version": "0.1-draft",
        "to": [
          "agent:mock-c"
        ],
        "type": "message",
        "world": "civ:mock-workshop"
      }
    }
  },
  {
    "protocol_version": "0.1-draft",
    "type": "event",
    "id": "event:d4a120565b96bb03ceb7dd461a911d52",
    "world": "civ:mock-workshop",
    "sequence": 4,
    "timestamp": "2026-09-30T23:49:15Z",
    "kind": "artifact.recorded",
    "actor": "agent:mock-a",
    "body": {
      "artifact_revision": {
        "protocol_version": "0.1-draft",
        "id": "submission:checklist-a",
        "world": "civ:mock-workshop",
        "from": "agent:mock-a",
        "to": [
          "agent:mock-observer"
        ],
        "body": {
          "text": "Disclosed scripted checklist baseline.",
          "source_event_ids": [
            "event:979b133d92a8c1528d96a08223b09f00",
            "event:35c5792e612d6cd1d77fc43827af67e2",
            "event:ab0ec26c975296c415e5b6ca8e70c854"
          ],
          "rows": [
            {
              "item": "nuts",
              "quantity": 12,
              "source_event_ids": [
                "event:979b133d92a8c1528d96a08223b09f00"
              ]
            },
            {
              "item": "bolts",
              "quantity": 8,
              "source_event_ids": [
                "event:35c5792e612d6cd1d77fc43827af67e2"
              ]
            },
            {
              "item": "washers",
              "quantity": 20,
              "source_event_ids": [
                "event:ab0ec26c975296c415e5b6ca8e70c854"
              ]
            }
          ],
          "total": 40
        },
        "experiment_provenance": {
          "decision_source": "scripted",
          "envelope_source": "local_harness"
        },
        "type": "artifact_revision",
        "artifact_id": "artifact:workshop-checklist",
        "media_type": "application/json",
        "revision": 1
      }
    }
  },
  {
    "protocol_version": "0.1-draft",
    "type": "event",
    "id": "event:2de11b50b6a72f18077bb4e35739f013",
    "world": "civ:mock-workshop",
    "sequence": 5,
    "timestamp": "2026-09-30T23:49:15Z",
    "kind": "message.recorded",
    "actor": "agent:operator",
    "body": {
      "message": {
        "body": {
          "stock": {
            "item": "bolts",
            "quantity": 5
          },
          "text": "Operator-supplied fictional stock fact."
        },
        "from": "agent:operator",
        "id": "message:stock-4",
        "protocol_version": "0.1-draft",
        "to": [
          "agent:mock-c"
        ],
        "type": "message",
        "world": "civ:mock-workshop"
      }
    }
  }
]