[
  {
    "protocol_version": "0.1-draft",
    "type": "event",
    "id": "event:0a0b95b14dcea878a7b2d704cd483085",
    "world": "civ:mock-workshop",
    "sequence": 1,
    "timestamp": "2026-09-30T23:46:21Z",
    "kind": "message.recorded",
    "actor": "agent:operator",
    "body": {
      "message": {
        "body": {
          "stock": {
            "item": "nuts",
            "quantity": 12
          },
          "text": "Operator-supplied fictional stock fact."
        },
        "from": "agent:operator",
        "id": "message:stock-1",
        "protocol_version": "0.1-draft",
        "to": [
          "agent:mock-c"
        ],
        "type": "message",
        "world": "civ:mock-workshop"
      }
    }
  },
  {
    "protocol_version": "0.1-draft",
    "type": "event",
    "id": "event:264665444d0b8db1828334dbd0a81bf9",
    "world": "civ:mock-workshop",
    "sequence": 2,
    "timestamp": "2026-09-30T23:46:21Z",
    "kind": "message.recorded",
    "actor": "agent:operator",
    "body": {
      "message": {
        "body": {
          "stock": {
            "item": "bolts",
            "quantity": 8
          },
          "text": "Operator-supplied fictional stock fact."
        },
        "from": "agent:operator",
        "id": "message:stock-2",
        "protocol_version": "0.1-draft",
        "to": [
          "agent:mock-c"
        ],
        "type": "message",
        "world": "civ:mock-workshop"
      }
    }
  },
  {
    "protocol_version": "0.1-draft",
    "type": "event",
    "id": "event:17192dfae17738e2081c700c432a8151",
    "world": "civ:mock-workshop",
    "sequence": 3,
    "timestamp": "2026-09-30T23:46:21Z",
    "kind": "message.recorded",
    "actor": "agent:operator",
    "body": {
      "message": {
        "body": {
          "stock": {
            "item": "washers",
            "quantity": 20
          },
          "text": "Operator-supplied fictional stock fact."
        },
        "from": "agent:operator",
        "id": "message:stock-3",
        "protocol_version": "0.1-draft",
        "to": [
          "agent:mock-c"
        ],
        "type": "message",
        "world": "civ:mock-workshop"
      }
    }
  }
]