[
  {
    "protocol_version": "0.1-draft",
    "type": "event",
    "id": "event:dd71dcfc00ad5dff399d0f4b3a6d7dd5",
    "world": "civ:mock-workshop",
    "sequence": 1,
    "timestamp": "2026-09-30T23:40:55Z",
    "kind": "message.recorded",
    "actor": "agent:operator",
    "body": {
      "message": {
        "body": {
          "stock": {
            "item": "nuts",
            "quantity": 12
          },
          "text": "Operator-supplied fictional stock fact."
        },
        "from": "agent:operator",
        "id": "message:stock-1",
        "protocol_version": "0.1-draft",
        "to": [
          "agent:mock-c"
        ],
        "type": "message",
        "world": "civ:mock-workshop"
      }
    }
  },
  {
    "protocol_version": "0.1-draft",
    "type": "event",
    "id": "event:402e596a26690b7c135f14781987e7ef",
    "world": "civ:mock-workshop",
    "sequence": 2,
    "timestamp": "2026-09-30T23:40:56Z",
    "kind": "message.recorded",
    "actor": "agent:operator",
    "body": {
      "message": {
        "body": {
          "stock": {
            "item": "bolts",
            "quantity": 8
          },
          "text": "Operator-supplied fictional stock fact."
        },
        "from": "agent:operator",
        "id": "message:stock-2",
        "protocol_version": "0.1-draft",
        "to": [
          "agent:mock-c"
        ],
        "type": "message",
        "world": "civ:mock-workshop"
      }
    }
  },
  {
    "protocol_version": "0.1-draft",
    "type": "event",
    "id": "event:a5adcae98658ec054579fe2df89522d3",
    "world": "civ:mock-workshop",
    "sequence": 3,
    "timestamp": "2026-09-30T23:40:56Z",
    "kind": "message.recorded",
    "actor": "agent:operator",
    "body": {
      "message": {
        "body": {
          "stock": {
            "item": "washers",
            "quantity": 20
          },
          "text": "Operator-supplied fictional stock fact."
        },
        "from": "agent:operator",
        "id": "message:stock-3",
        "protocol_version": "0.1-draft",
        "to": [
          "agent:mock-c"
        ],
        "type": "message",
        "world": "civ:mock-workshop"
      }
    }
  }
]