[
  {
    "protocol_version": "0.1-draft",
    "type": "event",
    "id": "event:553817b21126cca1334b82636ab7d9cc",
    "world": "civ:reader-collaboration",
    "sequence": 1,
    "timestamp": "2026-10-01T03:05:16Z",
    "kind": "artifact.recorded",
    "actor": "agent:reader-guide",
    "body": {
      "artifact_revision": {
        "protocol_version": "0.1-draft",
        "type": "artifact_revision",
        "id": "submission:notes-1",
        "world": "civ:reader-collaboration",
        "from": "agent:reader-guide",
        "to": [
          "agent:reader-observer"
        ],
        "body": {
          "text": "Earlier notes. This source mistakenly claimed first-page reading was complete, artifact IDs were globally unique chains, and citations transferred authority.",
          "assertions": [
            {
              "topic": "pagination",
              "value": "first"
            },
            {
              "topic": "chain_identity",
              "value": "artifact_only"
            },
            {
              "topic": "citation_authority",
              "value": "transferred"
            }
          ]
        },
        "artifact_id": "artifact:interface-notes",
        "media_type": "application/json",
        "revision": 1
      }
    }
  }
]