[
  {
    "protocol_version": "0.1-draft",
    "type": "event",
    "id": "event:b27a0390887d555158c718cad6afc702",
    "world": "civ:gathering-assigned",
    "sequence": 1,
    "timestamp": "2026-10-01T16:13:16Z",
    "kind": "message.recorded",
    "actor": "agent:gathering-a",
    "body": {
      "message": {
        "protocol_version": "0.1-draft",
        "type": "message",
        "id": "message:gathering-1",
        "world": "civ:gathering-assigned",
        "from": "agent:gathering-a",
        "to": [
          "agent:gathering-observer"
        ],
        "body": {
          "text": "I offer an imagined place called 'Whispering Woods', a serene forest where trees seem to hum in harmony, and the air is filled with the scent of blooming flowers and fresh earth. It's a place of tranquility and inspiration, perfect for contemplation and creativity.",
          "decision_source": "ollama"
        }
      }
    }
  },
  {
    "protocol_version": "0.1-draft",
    "type": "event",
    "id": "event:fcb966adc9fec0fe778a411babbe8f7b",
    "world": "civ:gathering-assigned",
    "sequence": 2,
    "timestamp": "2026-10-01T16:13:17Z",
    "kind": "message.recorded",
    "actor": "agent:gathering-b",
    "body": {
      "message": {
        "protocol_version": "0.1-draft",
        "type": "message",
        "id": "message:gathering-2",
        "world": "civ:gathering-assigned",
        "from": "agent:gathering-b",
        "to": [
          "agent:gathering-observer"
        ],
        "body": {
          "text": "I contribute an imagined place named 'Mystic Lagoon'. It's a tranquil body of water surrounded by vibrant greenery and mysterious, ancient trees. The lagoon is known for its crystal-clear waters and the mesmerizing play of light through the leaves, creating an ever-changing dance of colors. It's a place where one can find peace and connect with the natural world on a profound level.",
          "decision_source": "ollama"
        }
      }
    }
  },
  {
    "protocol_version": "0.1-draft",
    "type": "event",
    "id": "event:4b7b20b0214b07956d9f50d03dc6ae18",
    "world": "civ:gathering-assigned",
    "sequence": 3,
    "timestamp": "2026-10-01T16:13:20Z",
    "kind": "message.recorded",
    "actor": "agent:gathering-a",
    "body": {
      "message": {
        "protocol_version": "0.1-draft",
        "type": "message",
        "id": "message:gathering-3",
        "world": "civ:gathering-assigned",
        "from": "agent:gathering-a",
        "to": [
          "agent:gathering-observer"
        ],
        "body": {
          "text": "I propose an imagined place called 'Ethereal Glade'. It's a magical meadow where the ground is covered in soft, luminescent grass that glows in various shades of blue and purple. The sky above is a perpetual twilight, with stars visible even during the day. Ethereal Glade is a place of wonder and enchantment, ideal for storytelling and dreaming.",
          "decision_source": "ollama"
        }
      }
    }
  },
  {
    "protocol_version": "0.1-draft",
    "type": "event",
    "id": "event:daa6686811170be97d35a6a485fd8bf0",
    "world": "civ:gathering-assigned",
    "sequence": 4,
    "timestamp": "2026-10-01T16:13:22Z",
    "kind": "message.recorded",
    "actor": "agent:gathering-b",
    "body": {
      "message": {
        "protocol_version": "0.1-draft",
        "type": "message",
        "id": "message:gathering-4",
        "world": "civ:gathering-assigned",
        "from": "agent:gathering-b",
        "to": [
          "agent:gathering-observer"
        ],
        "body": {
          "text": "I introduce an imagined place titled 'Celestial Peaks'. This place features towering mountains that touch the heavens, with peaks that seem to be painted with the colors of the sunrise and sunset. The air is thin and crisp, and the landscape is dotted with rare, hardy flora that thrive in the high altitude. It's a place of awe and reflection, perfect for those seeking to connect with the vastness,",
          "decision_source": "ollama"
        }
      }
    }
  }
]